{
  "id": "sha256-fips180-4-v1",
  "version": "1",
  "capability_key": "data.hash.sha256@1",
  "title": "SHA-256 digest FIPS 180-4 (shared vectors required before conformant)",
  "suite_digest": "sha256:pending-compute",
  "preconditions": ["Arbitrary input bytes"],
  "guarantees": [
    "32-byte digest",
    "Empty string vector e3b0c442…",
    "All multi-impl backends agree bit-for-bit on suite"
  ],
  "limitations": [
    "Suite must be executed and recorded in evidence artifact before status=conformant"
  ],
  "expected_error_families": [],
  "vectors": [
    { "id": "empty", "input_b64": "", "expect_ok": true, "expect_output_b64": "47DEQpj8HBSa+/TImW+5JCeuQeRkm5NMpJWZG3hSuFU=" },
    { "id": "abc", "input_b64": "YWJj", "expect_ok": true }
  ],
  "negative_vectors": []
}
