{
  "id": "json-subset-pilot-v1",
  "version": "1",
  "capability_key": "data.json.parse@1",
  "title": "Narrow pilot subset for reference recursive-descent parser",
  "suite_digest": "sha256:pending-compute",
  "preconditions": ["UTF-8 input", "Pilot pilot object/array/scalar shapes only"],
  "guarantees": [
    "Parses suite-positive vectors used by Gate A pilot",
    "Does not claim full RFC 8259 (escapes, deep nesting, numbers edge cases)"
  ],
  "limitations": [
    "Not a full RFC 8259 implementation",
    "Must not be marked conformant against json-rfc8259-core-v1 without suite expansion"
  ],
  "expected_error_families": ["invalid-syntax", "invalid-unicode"],
  "vectors": [
    { "id": "object_simple", "input_b64": "eyJoZWxsbyI6IndvcmxkIn0=", "expect_ok": true },
    { "id": "array", "input_b64": "WzEsIngiLG51bGxd", "expect_ok": true }
  ],
  "negative_vectors": [
    { "id": "bad_utf8", "input_b64": "/w==", "expect_error_family": "invalid-unicode" }
  ]
}
